{"schema_version":"1.0.0","run_id":"run-1","parent_run_id":null,"runner_build":"m0","plan_hash":"aaaaaaaaaaaaaaaaaaaaaaaaaaaaaaaaaaaaaaaaaaaaaaaaaaaaaaaaaaaaaaaa","immutable_target":{"kind":"mock"},"environment_instance_id":"instance-1","lease_id":"lease-1","inventory_refs":{"start":"inventory/start.json","end":null},"execution_state":"planned","gate_state":"pending","report_state":"pending","raw_exit":null,"raw_signal":null,"started_at":"2026-09-10T00:00:00Z","finished_at":null,"evidence_refs":[]}
